{
    "id": "blythburgh-liberator-42-110007-",
    "title": "Blythburgh (PB4Y-1) Memorial",
    "location_name": "Blythburgh, Suffolk",
    "county": "Suffolk",
    "country": "United Kingdom",
    "region_code": "SF-001",
    "crash_date": "1944-08-12",
    "aircraft_type": "Liberator 42-110007 (PB4Y-1)",
    "squadron": "USN Special Air Unit",
    "station": "Fersfield",
    "crew_summary": "2 killed: Lt. Joseph P. Kennedy Jr. and Lt. Wilford \"Bud\" Willy (secret Aphrodite mission - Joe Kennedy's brother)",
    "memorial_type": "Stone marker",
    "sources": [
        {
            "title": "Geograph Suffolk",
            "type": "website"
        }
    ],
    "contributor": "Keith Binley",
    "last_updated": "2026-03-21",
    "data_quality": "Partial",
    "latitude": 52.129177272671335,
    "longitude": 1.1048070725196752,
    "maintainer": {
        "organisation": "Blythburgh Parish Council",
        "maintainer_type": "parish-council"
    },
    "external_narratives": [
        {
            "source_site": "Wikipedia",
            "original_url": "https://en.wikipedia.org/wiki/Joseph_P._Kennedy_Jr.",
            "summary": "Lt Joseph P. Kennedy Jr., eldest son of Ambassador Joseph Kennedy and older brother of future President John F. Kennedy, volunteered for Operation Aphrodite. On 12 August 1944, his BQ-8 drone aircraft (converted PB4Y-1 Liberator, serial 42-110007) loaded with 21,170 lb of Torpex explosive detonated prematurely over Blythburgh, Suffolk before the planned crew bailout.",
            "key_details": [
                "Kennedy was JFK's older brother",
                "Eldest son of Ambassador Joseph Kennedy",
                "Volunteered for dangerous Aphrodite mission",
                "21,170 lb Torpex explosive payload",
                "Last words: radio code 'Spade Flush'",
                "Premature detonation before planned bailout near RAF Manston"
            ],
            "date_retrieved": "2026-03-23",
            "still_live": true
        },
        {
            "source_site": "American Air Museum",
            "original_url": "https://www.americanairmuseum.com/archive/aircraft/42-110007",
            "summary": "The American Air Museum records aircraft 42-110007 as a PB4Y-1 Liberator used in Operation Aphrodite, a programme using radio-controlled explosive-laden bombers against hardened V-weapon sites in France.",
            "key_details": [
                "American Air Museum aircraft record",
                "Target was suspected V-3 site at Mimoyecques"
            ],
            "date_retrieved": "2026-03-23",
            "still_live": true
        },
        {
            "source_site": "The History Reader",
            "original_url": "https://www.thehistoryreader.com/military-history/joe-kennedy-jr-fallen-hero-operation-aphrodite/",
            "summary": "Detailed account of Kennedy's Aphrodite mission, describing how the BQ-8 completed its first remote-controlled turn at 2,000 feet near the North Sea coast before the explosives detonated prematurely. Kennedy and co-pilot Lt Wilford 'Bud' Willy were killed instantly; wreckage scattered near Blythburgh causing damage but no ground casualties.",
            "key_details": [
                "Aircraft completed first remote turn at 2,000 feet",
                "Premature detonation near North Sea coast",
                "Co-pilot was Lt Wilford 'Bud' Willy",
                "Wreckage hit Blythburgh area, no ground casualties",
                "Kennedy had already completed 25 combat missions"
            ],
            "date_retrieved": "2026-03-23",
            "still_live": true
        },
        {
            "source_site": "Warfare History Network",
            "original_url": "https://warfarehistorynetwork.com/article/operation-aphrodite/",
            "summary": "Overview of Operation Aphrodite, the secret programme using converted B-17 and PB4Y-1 bombers as radio-controlled flying bombs against V-weapon sites. Kennedy's Navy mission was part of this larger Allied effort to destroy hardened German targets that conventional bombing could not reach.",
            "key_details": [
                "Secret programme using drone bombers",
                "Targeted V-weapon sites",
                "Both Army (B-17) and Navy (PB4Y-1) variants used"
            ],
            "date_retrieved": "2026-03-23",
            "still_live": true
        }
    ],
    "local_contacts": [
        {
            "org_name": "Lowestoft Royal British Legion",
            "org_type": "british_legion",
            "role": "Local remembrance and memorial support",
            "website": "https://counties.britishlegion.org.uk/counties/suffolk/contact-us/branches/"
        },
        {
            "org_name": "Blythburgh Parish Council",
            "org_type": "parish_council",
            "role": "Local authority responsible for memorial upkeep"
        }
    ],
    "what3words": "pacemaker.mildest.jacket"
}