{
    "id": "bleasby-4-jb132",
    "title": "Bleasby (4) Lancaster Memorial",
    "location_name": "Bleasby (4), Nottinghamshire",
    "county": "Nottinghamshire",
    "country": "United Kingdom",
    "region_code": "NT-005",
    "crash_date": "1943-09-01",
    "aircraft_type": "Lancaster",
    "serial_number": "JB132",
    "squadron": "61 Squadron",
    "station": "Syerston",
    "crew_summary": "8 killed including Sqn Ldr. Dennis Crosby Wellburn, DFC",
    "memorial_type": "Memorial stone",
    "sources": [
        {
            "title": "Geograph",
            "type": "website"
        },
        {
            "title": "Aircrew Remembered - Bleasby Aircrew Memorial",
            "url": "https://aircrewremembered.com/bleasby-aircrew-memorial.html",
            "type": "website"
        }
    ],
    "contributor": "Keith Binley",
    "last_updated": "2026-03-21",
    "data_quality": "Partial",
    "latitude": 53.0233001738672,
    "longitude": -1.0813898173363627,
    "maintainer": {
        "organisation": "Bleasby Parish Council",
        "website": "https://www.bleasbycommunity.uk",
        "maintainer_type": "parish-council",
        "notes": "Part of the Bleasby Aircrew Memorial site."
    },
    "external_narratives": [
        {
            "source_site": "Aircrewremembered.com",
            "original_url": "https://aircrewremembered.com/wellburn-dennis.html",
            "summary": "Lancaster JB132 of 61 Squadron departed RAF Syerston at 20:08 on 31 August 1943 to bomb Berlin. Returning at 03:26 on 1 September, it collided head-on at 1,500 feet with Lancaster R5698 of 1654 HCU. An explosion and fire occurred in mid-air, killing all 8 crew including Sqn Ldr Dennis Crosby Wellburn DFC, aged 27.",
            "key_details": [
                "Departed Syerston 20:08 for Berlin raid",
                "Head-on collision at 03:26 at 1,500 feet",
                "Explosion and fire in mid-air",
                "Wellburn aged 27, held DFC",
                "Full crew: Clarke, Watson, Forrest, Davies, Blackett, Joyce, Paterson"
            ],
            "date_retrieved": "2026-03-24",
            "still_live": true,
            "full_narrative": "## Dedication Saturday 01st September 2018 12:00 noon\n\n## Featured On Propeller Circle\n\n## Featured On Tail Fin\n\n&bull; Kracker Archive &bull; Allied Losses &bull; Archiwum Polish &bull; Paradie Canadian &bull; RCAF &bull; RAAF &bull; RNZAF &bull; USA &bull; Searchable Lists The Bleasby Aircrews Memorial\n\nIt is expected that over 40 relatives from the crews will be attending as well as representatives from the RAF, RAAF, Polish Air Force. If you are unable to attend but would like details sent to you after the event please advise us. We would appreciate that you circulate details of the event via your various social media contacts.\n\nThe Memorial concept was created by a Nottingham architect Keith Clark, acting as a volunteer, and a villager Derek McGrath.\n\nManufacturing feasibility and detailed design was developed by Michael Wright, of D and M Stonemasons of Nottingham. Michael procured the granite stone from India, where the components were specially quarried, cut and polished to the design. The near finished components were shipped to Michael's workshop where Michael completed the finishing touches.\n\nAn information book, compiled by Ken Ogilvie, is available for visitors to read in the Waggon and Horses pub nearby, where food and drink is available if required.\n\nThis moving and memorable Bleasby Community project was conceived to honour crews who flew from nearby RAF Syerston.\n\nRAF Syerston was built as part of the bomber expansion in the late 1930s, but did not open until 1 December 1940. The first aircraft were Vickers Wellingtons crewed by Polish flyers. In July 1941 they were replaced by members of the RCAF flying Handley-Page Hampdens. From December 1941 until 5 May 1942, the base was closed whilst a concrete runway was built with two T2 hangars. When it re-opened, it became part of No. 5 Group. In 1942 several squadrons of Avro Lancaster aircraft arrived. In 1943 Bill Reid of 61 Squadron won a Victoria Cross on a mission flown from RAF Syerston.\n\nOn 17 November 1943 the operational squadrons departed, and the station was used for bomber crew training, led by Captain Robert White. It became known as the Lancaster Finishing School in January 1944. From November 1943 to July 1944 there was also a Bombing and Gunnery Defence Training Flight in attendance with several Wellingtons, Spitfires, Hurricanes, plus a few Martinet tug aircraft, all employed in brushing up the skills of air gunners on air-to-air exercises. The LFS left on 1 April 1945, with No. 49 Squadron arriving from RAF Fulbeck later in the month who only had one operation before leaving to RAF Mepal in September.\n\nUpdated photo memorial with turf laid - June 2018\n\nFundraising is ongoing to complete the foundations and landscaping. This may include the construction of a new brick wall to complete a backdrop, at right angles to, and to match the existing one that marks the boundary with the churchyard. The Bleasby Local History Society have applied for a second grant towards the cost of this work, and if awarded, then this may happen shortly.\n\nThis has been a Bleasby Community project, led by Ken Ogilvie, involving members of the Bleasby Local History Society, The Bleasby Parochial Church Council (St Marys Church), and the Bleasby Parish Council. Fundraising involved a variety of village activities and events, including the Bleasby Aircrews memorial steam train excursion, voluntary donations, and a grant from the Nottinghamshire County Council.\n\nIf you are unable to attend and wish to place a wreath or, better still donate towards the cost of this wonderful memorial please contact webmaster here .\n\n61 Squadron Lancaster III JB132:\n\nSq/Ldr. Dennis Crosby Wellburn DFC. of Vancouver, British Columbia, Canada.\n\nF/O. Roy Leslie Clarke of Hastings, Victoria, Australia.\n\nSgt. John Knox Watson of Mid Calder, West Lothian, Scotland\n\nSgt. John Reid Forrest of Glasgow, Scotland.\n\nFl/Lt. Richard Edward Davies of West Wickham, Kent, England.\n\nSgt. Jack Blackett of Durham, England.\n\nF/O. Trevor Francis Joyce of Ruislip, Middlesex, England .\n\nSgt. Alan Paterson of Glendevon, Perthshire, Scotland.\n\nFor further details on this loss read it here.\n\n1654 Heavy Conversion Unit Lancaster I R5698:\n\nP/O. Joseph Widger Murphy Macdonald of Knighton, Radnorshire, Wales.\n\nSgt. George Robert Joyce of Northfleet, Gravesend, Kent, England.\n\nF/O. Walter Stephen Jobling DFC of Lincoln, England.\n\nSgt. Thomas George William Shepherd of Stockton-on-Tees, England. (1)\n\nSgt. Edward Neilan Jones of Wallasey, England.\n\nSgt. George Herbert Tough of Rathgar, Dublin, Ireland.\n\nSgt. John Henry Hutchinson of of Liverpool, England.\n\nFl/Sgt. Robert William Rashbrook of Bassendean, Western Australia.\n\n(1) From new information received September 07th 2018 - enquiries are being made to establish how we are able to add his name to the memorial.\n\nFor further details on this loss read it here\n\n304 Squadron (P) Wellington R1014:\n\nSgt. Stanisław Tofin of Krzyszkowice, Myślenice, Poland.\n\nSgt."
        },
        {
            "source_site": "Aviation Safety Network",
            "original_url": "https://asn.flightsafety.org/wikibase/210390",
            "summary": "ASN records the mid-air collision accident of Lancaster III JB132 on 1 September 1943, classified as a mid-air collision during return from operations.",
            "key_details": [
                "ASN reference 210390",
                "Classified as mid-air collision"
            ],
            "date_retrieved": "2026-03-23",
            "still_live": true
        },
        {
            "source_site": "IWM War Memorials Register",
            "original_url": "https://www.iwm.org.uk/memorials/item/memorial/86723",
            "summary": "IWM records the Bleasby Air Crews memorial that includes the JB132 crew among the approximately 40 airmen commemorated from multiple wartime crashes near the village.",
            "key_details": [
                "IWM memorial reference 86723"
            ],
            "date_retrieved": "2026-03-23",
            "still_live": true
        }
    ],
    "local_contacts": [
        {
            "org_name": "Southwell Royal British Legion",
            "org_type": "british_legion",
            "role": "Local remembrance and memorial support",
            "website": "https://counties.britishlegion.org.uk/counties/nottinghamshire/contact-us/branches/"
        },
        {
            "org_name": "Bleasby Parish Council",
            "org_type": "parish_council",
            "role": "Local authority responsible for memorial upkeep",
            "website": "https://www.bleasbycommunity.uk"
        }
    ],
    "squadron_badge_url": "https://rafweb.org/Badges/RAFHT/61.jpg",
    "squadron_motto": "Per ardua ad aethera tendo",
    "what3words": "farmer.nerve.obtain"
}