{
    "id": "waithe-4-jb560",
    "title": "Waithe (4) Lancaster Memorial",
    "location_name": "Waithe (4), Lincolnshire",
    "county": "Lincolnshire",
    "country": "United Kingdom",
    "region_code": "LN-038",
    "crash_date": "1943-12-16",
    "aircraft_type": "Lancaster",
    "serial_number": "JB560",
    "squadron": "100 Sqdn.",
    "station": "Grimsby",
    "crew_summary": "5 killed; pilot Wg Cdr. David W. Holford, DSO, DFC",
    "memorial_type": "Combined memorial",
    "sources": [
        {
            "title": "Geograph",
            "type": "website"
        }
    ],
    "contributor": "Keith Binley",
    "last_updated": "2026-03-21",
    "data_quality": "Partial",
    "latitude": 53.230936447763646,
    "longitude": -0.22787069153771128,
    "maintainer": {
        "organisation": "Waithe Parish Meeting",
        "maintainer_type": "parish-council"
    },
    "external_narratives": [
        {
            "source_site": "Wikipedia",
            "original_url": "https://en.wikipedia.org/wiki/David_Holford_(RAF_officer)",
            "summary": "Biographical article on Wing Commander David William Holford DSO DFC (21 February 1921 - 17 December 1943), who was the youngest bomber squadron commanding officer in RAF history when he took command of 100 Squadron at age 21 in February 1943.",
            "key_details": "Holford was 22 when killed. He had already completed two full tours of operations. Appointed CO of 100 Squadron at Waltham on 21 November 1943. Crashed Lancaster JB560 in thick fog near Kelstern after the Black Thursday Berlin raid.",
            "date_retrieved": "2026-03-23",
            "still_live": true
        },
        {
            "source_site": "IBCC Digital Archive",
            "original_url": "https://losses.internationalbcc.co.uk/loss/111010/",
            "summary": "International Bomber Command Centre loss record for Lancaster JB560 and W/C Holford. Documents the operational details and crew information for this Black Thursday loss.",
            "key_details": "IBCC loss record reference 111010. Lancaster JB560 was the aircraft carrying the 100 Squadron commanding officer on the Berlin raid of 16/17 December 1943.",
            "date_retrieved": "2026-03-23",
            "still_live": true
        },
        {
            "source_site": "War Memorials Online",
            "original_url": "https://www.warmemorialsonline.org.uk/memorial/262658/",
            "summary": "The Waithe combined memorial commemorates W/C Holford's crew alongside three other 100 Squadron Lancaster crews lost on Black Thursday. The memorial is a black polished marble tablet on the A16 Louth Road.",
            "key_details": "Holford's loss was devastating for 100 Squadron — losing their CO alongside multiple other crews in a single night. Two crew members survived the crash of JB560.",
            "date_retrieved": "2026-03-23",
            "still_live": true
        },
        {
            "source_site": "RAF Commands",
            "original_url": "https://www.rafcommands.com/database/wardead/details.php?qnum=81728",
            "summary": "RAF Commands war dead database entry for Wing Commander D.W. Holford (service number 41704), recording his death on 17 December 1943 while serving with 100 Squadron.",
            "key_details": "Service number 41704. Holford held both the DSO and DFC. His death at 22 made him one of the youngest wing commanders to be killed in Bomber Command.",
            "date_retrieved": "2026-03-23",
            "still_live": true
        }
    ],
    "local_contacts": [
        {
            "org_name": "Great Grimsby Royal British Legion",
            "org_type": "british_legion",
            "role": "Local remembrance and memorial support",
            "website": "https://counties.britishlegion.org.uk/counties/lincolnshire/branches-contacts/"
        },
        {
            "org_name": "Waithe Parish Meeting",
            "org_type": "parish_council",
            "role": "Local authority responsible for memorial upkeep"
        }
    ],
    "squadron_badge_url": "https://rafweb.org/Badges/RAFHT/100.jpg",
    "squadron_motto": "Sarang tebuan jangan dijolok",
    "what3words": "racetrack.variation.tungsten",
    "photos": [
        {
            "filename": "waithe-4-jb560/5cab2007c809e_Capture_547x410.JPG",
            "caption": "5cab2007c809e Capture 547x410",
            "credit": "Grimsby Telegraph / War Memorials Online"
        },
        {
            "filename": "waithe-4-jb560/5cab200837f7d_Waithe_House_Farm_2_547x410.jpg",
            "caption": "5cab200837f7d Waithe House Farm 2 547x410",
            "credit": "Grimsby Telegraph / War Memorials Online"
        },
        {
            "filename": "waithe-4-jb560/5cab2009188f7_Waithe_House_Farm_4_547x410.jpg",
            "caption": "5cab2009188f7 Waithe House Farm 4 547x410",
            "credit": "Grimsby Telegraph / War Memorials Online"
        }
    ]
}